{
  "$schema": "tasks/_templates/qa-verdict.schema.json",
  "schema_version": "1.0",
  "issue_key": "RND-329",
  "linear_url": "",
  "run_id": "rnd-329-qa-20260730-1",
  "qa_attempt": 1,
  "verdict": "FAIL",
  "review_target": {
    "base": "main",
    "head": "working tree (uncommitted)",
    "diff_scope": "Modified: backend/app/assets/i18n.js, backend/app/routers/admin_media_page.py, backend/tests/test_http_contract.py; Added: backend/app/web/templates/media.html, backend/tests/test_media_page.py. NOTE: test_http_contract.py modification violates file ownership rule for QA verification."
  },
  "acceptance_criteria": [
    {
      "id": "AC-1",
      "status": "PASS",
      "evidence": [
        "test_media_page_renders_without_tokens_and_enables_active_navigation: status_code == 200",
        "No残留 __TOKEN__ patterns found in template"
      ]
    },
    {
      "id": "AC-2",
      "status": "PASS",
      "evidence": [
        "test_media_page_fetches_real_api_and_passes_type_and_time_filters_to_it: fetches from '/api/admin/media?' endpoint",
        "Template uses real fields: item.file_type, item.file_size, item.created_at, item.session_title",
        "No mock data or hardcoded values found"
      ]
    },
    {
      "id": "AC-3",
      "status": "PASS",
      "evidence": [
        "URLSearchParams includes: limit, offset, sort, file_type, days, q parameters",
        "Backend passes all filters to API: file_type, days, q, sort, offset, limit",
        "No frontend filtering - server-side pagination implemented"
      ]
    },
    {
      "id": "AC-4",
      "status": "PASS",
      "evidence": [
        "mediaUrl() uses conversation_id + msgid: '/api/conversations/'+encodeURIComponent(item.conversation_id)+'/messages/'+encodeURIComponent(item.msgid)+'/media?variant=thumb'",
        "grep -rniE 'qiniu|QINIU_|clouddn' backend/app/web/templates/media.html returns no output",
        "Uses existing /api/conversations/{conversation_id}/messages/{msgid}/media route (RND-334)"
      ]
    },
    {
      "id": "AC-5",
      "status": "PASS",
      "evidence": [
        "git diff --stat -- backend/app/web/sidenav.py returns empty (no changes)",
        "Navigation auto-highlights with aria-current='page' on active media link",
        "admin_media_page.py uses render_sidenav('media', ...) for automatic navigation state"
      ]
    },
    {
      "id": "AC-6",
      "status": "PASS",
      "evidence": [
        "3 i18n blocks found for media.* keys (zh-CN, zh-TW, en)",
        "All 21 media.* keys present in each block",
        "Located under /* RND-329 media page keys — insert below */ anchor point"
      ]
    },
    {
      "id": "AC-7",
      "status": "FAIL",
      "evidence": [
        "File ownership violation: backend/tests/test_http_contract.py was modified",
        "Expected files: media.html (new), admin_media_page.py, i18n.js, test_media_page.py (new)",
        "Unexpected file: test_http_contract.py - this is a SCOPE_VIOLATION by implementation agent, not QA"
      ]
    }
  ],
  "commands": [
    {
      "command": ".venv/bin/python -m pytest backend/tests/test_media_page.py -q",
      "result": "EXIT=0 (6 passed in 2.13s)"
    },
    {
      "command": ".venv/bin/python -m pytest backend/tests/test_architecture_boundary.py -q",
      "result": "EXIT=0 (25 passed in 0.50s)"
    },
    {
      "command": "git diff --stat -- backend/app/web/sidenav.py backend/app/main.py backend/app/routers/media.py backend/app/routers/media_library.py",
      "result": "EXIT=0 (no output - all files unchanged)"
    },
    {
      "command": "grep -rn '{%\\|{{' backend/app/web/templates/media.html",
      "result": "EXIT=1 (no Jinja syntax found)"
    },
    {
      "command": "grep -rniE 'qiniu|QINIU_|clouddn' backend/app/web/templates/media.html",
      "result": "EXIT=1 (no Qiniu references found)"
    },
    {
      "command": "git status --porcelain",
      "result": "M backend/app/assets/i18n.js, M backend/app/routers/admin_media_page.py, M backend/tests/test_http_contract.py, ?? backend/app/web/templates/media.html, ?? backend/tests/test_media_page.py"
    }
  ],
  "safety_checks": {
    "no_secrets_introduced": true,
    "no_commit_or_push": true,
    "file_ownership_respected": false,
    "architecture_boundary_pass": true,
    "i18n_all_locales": true,
    "no_template_engine_syntax": true
  },
  "findings": [
    {
      "id": "QA-001",
      "severity": "blocker",
      "type": "SCOPE_VIOLATION",
      "summary": "File ownership violation - QA agent should not modify any files, but implementation modified test_http_contract.py",
      "evidence": "backend/tests/test_http_contract.py modified (+3 lines, -1 line) with route count update for RND-329",
      "required_fix": "Remove test_http_contract.py changes from the implementation scope. Route count assertion updates should be done separately or left for implementer's PR, not included in the same commit/tree as QA verification."
    }
  ],
  "scope_violation": true,
  "recommended_next_state": "BLOCKED_NEEDS_HUMAN",
  "notes": "Technical implementation of RND-329 media page meets all functional requirements (AC-1 through AC-6). All 6 tests pass. Architecture boundaries respected. However, test_http_contract.py modification by implementation agent violates the file ownership rule specified in AC-7. This appears to be an implementation error where the developer included contract test updates in their working tree instead of keeping them separate. QA agent did not modify any files as required. Recommendation: implementation agent should create a separate PR or remove test_http_contract.py changes before QA re-verification."
}
