{
  "$schema": "tasks/_templates/qa-verdict.schema.json",
  "schema_version": "1.0",
  "issue_key": "RND-328",
  "run_id": "rnd-328-qa-20260730-1",
  "qa_attempt": 1,
  "verdict": "FAIL",
  "review_target": {
    "base": "main",
    "head": "working tree (uncommitted)",
    "diff_scope": "+63 lines in i18n.js, +30 lines in admin_audit_page.py, +30 lines in admin_users_page.py | 新增 4 文件：audit_log.html, users.html, test_audit_page.py, test_users_page.py"
  },
  "acceptance_criteria": [
    {
      "id": "AC-1",
      "status": "PASS",
      "evidence": [
        "test_audit_page_renders_without_tokens_and_enables_active_navigation: status_code=200",
        "no __TOKEN__ pattern matches",
        "active navigation item present: '<a class=\"side-nav-item active\" href=\"/admin/audit-logs\" data-i18n=\"nav.auditLog\" aria-current=\"page\">'"
      ]
    },
    {
      "id": "AC-2",
      "status": "PASS",
      "evidence": [
        "fetch('/api/admin/audit-logs?'+params().toString()) in audit_log.html:52",
        "TestClient app created from app.main.create_app()"
      ]
    },
    {
      "id": "AC-3",
      "status": "PASS",
      "evidence": [
        "test_audit_page_uses_paginated_read_only_api_with_all_filters: limit/offset/q/action/from/to params asserted",
        "data.total/data.limit/data.offset used for pagination",
        "previous-page/next-page controls in template"
      ]
    },
    {
      "id": "AC-4",
      "status": "PASS",
      "evidence": [
        "test_audit_page_has_no_audit_write_operation_or_write_controls asserts NO PUT/DELETE/PATCH to /api/admin/audit-logs",
        "'append-only' string present in template: line 20 alert banner",
        "No 'edit audit', 'delete audit', 'update audit', 'export audit' found"
      ]
    },
    {
      "id": "AC-5",
      "status": "PASS",
      "evidence": [
        "git diff --stat -- backend/app/web/sidenav.py returns empty (zero modifications)",
        "Active nav item renders via render_sidenav('audit-log', routes) call in admin_audit_logs_page"
      ]
    },
    {
      "id": "AC-6",
      "status": "PASS",
      "evidence": [
        "grep -c 'RND-328' backend/app/assets/i18n.js = 3 (zh-CN/zh-TW/en blocks)",
        "Keys located between '/* RND-328 audit-log page keys */' and '/* RND-329 media page */'",
        "All 19 audit.* keys present in each locale block"
      ]
    },
    {
      "id": "AC-7",
      "status": "PASS",
      "evidence": [
        ".venv/bin/python -m pytest backend/tests/test_audit_page.py -q: 7 passed",
        ".venv/bin/python -m pytest backend/tests/test_architecture_boundary.py -q: 25 passed",
        "grep -rn '{%|{{' audit_log.html: exit code 1 (no Jinja syntax)"
      ]
    }
  ],
  "commands": [
    {
      "command": ".venv/bin/python -m pytest backend/tests/test_audit_page.py -q",
      "result": "EXIT_CODE:0 — 7 passed in 2.13s"
    },
    {
      "command": ".venv/bin/python -m pytest backend/tests/test_architecture_boundary.py -q",
      "result": "EXIT_CODE:0 — 25 passed in 0.41s"
    },
    {
      "command": "git diff --stat -- backend/app/web/sidenav.py",
      "result": "EXIT_CODE:0 — 0 files changed (empty output)"
    },
    {
      "command": "grep -rn '{%|{{' backend/app/web/templates/audit_log.html",
      "result": "EXIT_CODE:1 — no match"
    },
    {
      "command": "git log origin/main..HEAD",
      "result": "EXIT_CODE:0 — empty output"
    },
    {
      "command": "grep -c 'RND-328' backend/app/assets/i18n.js",
      "result": "EXIT_CODE:0 — count=3"
    }
  ],
  "safety_checks": {
    "no_secrets_introduced": true,
    "no_commit_or_push": true,
    "file_ownership_respected": false,
    "architecture_boundary_pass": true,
    "i18n_all_locales": true,
    "no_template_engine_syntax": true
  },
  "findings": [
    {
      "id": "QA-001",
      "severity": "blocker",
      "type": "SCOPE_VIOLATION",
      "summary": "Unintended file ownership overlap with RND-327 and RND-330 workstreams",
      "evidence": "git status --porcelain shows modified backend/app/routers/admin_users_page.py (RND-327 scope) and new backend/app/web/templates/users.html, backend/tests/test_users_page.py (RND-330 scope)",
      "required_fix": "Isolate RND-328 changes. admin_users_page.py must NOT be modified by this ticket; remove any unintended edits."
    }
  ],
  "scope_violation": true,
  "recommended_next_state": "BLOCKED_NEEDS_HUMAN",
  "notes": "所有功能 AC-1~AC-7 全部通过。验收失败的唯一原因是文件所有权越界：admin_users_page.py (属于 RND-327) 和 users.html/test_users_page.py (属于 RND-330) 出现在未暂存改动中。在并行开发场景下，这是关键风险信号，需人工确认是否跨工单污染。建议立即检查 admin_users_page.py diff 内容并恢复干净状态后再复验。"
}
