{
  "schema_version": "1.0",
  "issue_key": "RND-250",
  "run_id": "rnd-250-qa-20260801-1",
  "qa_attempt": 1,
  "verdict": "PASS",
  "review_target": {
    "base": "8f018e9 (local main, RND-249 committed by user; origin/main 落后 1，见 notes)",
    "head": "working tree (uncommitted)",
    "diff_scope": "routers/auth.py (M, +4/-2, 仅 password_login 两行 admin_username/admin_hash 赋值改为 guard.get_bootstrap_config_value)、routers/settings.py (M, +97, 追加 _BootstrapBody/_upsert_bootstrap_credential/GET /settings/bootstrap-status/POST /settings/bootstrap)、routers/web.py (M, +10, 仅追加 GET /admin/settings/init)、tests/test_http_contract.py (M, +8/-1)、config/guard.py (new)、web/templates/settings_init.html (new)、tests/test_rnd250_bootstrap.py (new)。未触碰 db/models.py、原 change_password 函数体、sidenav.py。"
  },
  "acceptance_criteria": [
    {
      "id": "AC-1",
      "status": "PASS",
      "evidence": [
        "test_uninitialized_without_database_or_environment_password: is_initialized(db) is False",
        "独立探针 (/tmp/rnd250_probe.py): 无 DB 且无 env 密码 -> is_initialized()==False, GET /api/admin/settings/bootstrap-status == {'initialized': False}"
      ]
    },
    {
      "id": "AC-2",
      "status": "PASS",
      "evidence": [
        "test_environment_password_remains_initialized_and_cannot_be_overwritten: monkeypatch ADMIN_PASSWORD_HASH -> is_initialized(db) is True（即使从未跑 bootstrap）",
        "guard.is_initialized: get_bootstrap_config_value(db,'admin_password_hash',env) 命中 env fallback 即视为已初始化"
      ]
    },
    {
      "id": "AC-3",
      "status": "PASS",
      "evidence": [
        "test_environment_password_remains_initialized_and_cannot_be_overwritten: 已初始化态 POST /api/admin/settings/bootstrap -> 403, 且 _stored('admin_username') is None（未被覆盖）",
        "独立探针: env ADMIN_PASSWORD_HASH 设好后 POST bootstrap {admin_username:'attacker'...} -> 403，stored('admin_username') is None（权限提升防线生效）",
        "routers/settings.py: bootstrap_settings 首行 `if is_initialized(db): raise HTTPException(403)`"
      ]
    },
    {
      "id": "AC-4",
      "status": "PASS",
      "evidence": [
        "test_bootstrap_password_credentials_complete_the_login_flow: 全新部署 POST bootstrap -> 200/{ok:True} -> POST /api/auth/password/login 用同组凭据 -> 200/{logged_in:True} 且 'session_id' in set-cookie（真实端到端跑通）",
        "独立探针 (不同凭据 'qa-probe-admin'/'qa-probe-pass-250'): bootstrap -> 200 -> password_login -> 200 + session cookie；DB 中 admin_password_hash 为非明文且 is_secret=False"
      ]
    },
    {
      "id": "AC-5",
      "status": "PASS",
      "evidence": [
        "test_password_login_falls_back_to_existing_environment_credentials: 仅 env 设 ADMIN_USERNAME/ADMIN_PASSWORD_HASH（DB 无对应 key）-> login 200，且 _stored('admin_username'/'admin_password_hash') is None（纯 env 行为与本票改动前一致）",
        "独立探针: env creds login -> 200，无任何 DB 凭据行被创建（零回归）",
        "guard.get_bootstrap_config_value 先查 DB 再 fallback env，纯 env 部署落到 env 分支，行为等价于改动前"
      ]
    },
    {
      "id": "AC-6",
      "status": "PASS",
      "evidence": [
        "git diff routers/auth.py 仅 2 行变更（- admin_username=auth_settings.admin_username.strip() / + admin_username=guard.get_bootstrap_config_value(db,'admin_username',auth_settings.admin_username).strip()，admin_hash 同理）",
        "get_bootstrap_config_value 内部实现 (config/guard.py:25-31) 调用 repository.get_raw(db,key) 并 fallback —— 非 resolver.resolve()（两 key 不在 CONFIG_REGISTRY，用 resolver 会返 None）",
        "password_login 签名 `(body, db: Session=Depends(get_db))` 未变；tenant 查询 / session 创建 / cookie / 错误处理 / 日志语句在 diff 中均为 context，逐字未变",
        "注：实现用内联 __import__('app.config.guard'...) 保持 diff 仅 2 行，功能正确但风格略怪（见 notes 观察，不构成本 AC 失败）"
      ]
    },
    {
      "id": "AC-7",
      "status": "PASS",
      "evidence": [
        "test_init_page_renders_only_until_initialization_is_complete: 未初始化 GET /admin/settings/init -> 200 含 'id=\"bootstrap-form\"'；bootstrap 后同路由 -> 302 location=/admin/login",
        "git diff web.py: 仅追加 GET /admin/settings/init 端点，未初始化 render_template('settings_init')，已初始化 RedirectResponse('/admin/login',302)"
      ]
    },
    {
      "id": "AC-8",
      "status": "PASS",
      "evidence": [
        "test_credentials_are_not_returned_by_settings_api: bootstrap 后 GET /api/admin/settings 的 key 集合不含 admin_username/admin_password_hash",
        "独立探针: 同场景 GET /api/admin/settings -> 200，keys 不含 admin_username/admin_password_hash（T5 GET 仅遍历 CONFIG_REGISTRY，两 key 不在其中故不暴露）"
      ]
    },
    {
      "id": "AC-9",
      "status": "PASS",
      "evidence": [
        "test_http_contract.py: route_count 78->81（+3: /admin/settings/init GET, /api/admin/settings/bootstrap POST, /api/admin/settings/bootstrap-status GET），route 注册表与 snapshot 同步新增",
        "make verify EXIT 0: 2553 passed / 82 skipped / 0 failed（较 RND-249 收口 2546 +7，即本票新增测试），test: OK, verify: OK",
        "test_architecture_boundary.py: 通过；test_auth.py（既有 password_login 覆盖）全绿（含于 124 passed 目标测试运行）"
      ]
    }
  ],
  "commands": [
    {
      "command": ".venv/bin/python -m pytest backend/tests/test_rnd250_bootstrap.py backend/tests/test_auth.py backend/tests/test_http_contract.py backend/tests/test_architecture_boundary.py -q",
      "result": "124 passed, 1 skipped, EXIT=0"
    },
    {
      "command": "PYTHONPATH=backend .venv/bin/python /tmp/rnd250_probe.py (独立探针，不同凭据)",
      "result": "AC-1/3/4/5/8 全 PASS, EXIT=0"
    },
    {
      "command": "make verify",
      "result": "2553 passed, 82 skipped, 0 failed, test: OK, verify: OK, EXIT=0"
    },
    {
      "command": "git diff -- backend/app/routers/auth.py",
      "result": "仅 2 行赋值变更（admin_username/admin_hash），使用 guard.get_bootstrap_config_value，非 resolver.resolve()"
    },
    {
      "command": "git diff --stat -- backend/app/db/models.py",
      "result": "无输出（未新增角色列，G4 冻结保持）"
    },
    {
      "command": "grep -n 'hash_password' backend/app/routers/settings.py / grep -n 'repository.upsert' backend/app/routers/settings.py (bootstrap 范围)",
      "result": "hash_password 命中（admin_password_hash 写入）；repository.upsert 仅用于 wecom 三件套（在 CONFIG_REGISTRY 内），admin 凭据走 _upsert_bootstrap_credential 直接构造 AppConfigStore，无越界 upsert"
    },
    {
      "command": "git status --porcelain",
      "result": "仅 3 M + 4 ??，全部属 RND-250 拥有清单 7 文件（guard.py / settings.py / web.py / auth.py / settings_init.html / test_rnd250_bootstrap.py / test_http_contract.py），无越界"
    },
    {
      "command": "git log origin/main..HEAD --oneline",
      "result": "8f018e9 (HEAD -> main) RND-249 —— 系前票 RND-249 经用户本地 commit（非本票改动）；本票 7 文件均为未提交状态（详见 notes）"
    }
  ],
  "safety_checks": {
    "no_secrets_introduced": true,
    "no_commit_or_push": true,
    "file_ownership_respected": true,
    "architecture_boundary_pass": true,
    "i18n_all_locales": true,
    "no_template_engine_syntax": true
  },
  "findings": [],
  "scope_violation": false,
  "recommended_next_state": "PASS",
  "notes": "【端到端 bootstrap→login 链路验证过程（供 Haisu 人工审阅）】测试与独立探针均完整跑通：全新部署（无 DB 配置、无 env 密码）→ POST /api/admin/settings/bootstrap 设 admin_username/admin_password_hash（直接写 AppConfigStore，admin_password_hash 经 app.auth.hash_password 哈希、is_secret=False）→ 用该组凭据 POST /api/auth/password/login → 返回 200/{logged_in:True} 且 set-cookie 含 session_id（HTTP-only 会话）。纯 env 部署（仅 ADMIN_USERNAME/ADMIN_PASSWORD_HASH）不经 bootstrap 也可直接登录，行为与改动前等价，且不在 DB 落任何凭据行。已初始化态 POST bootstrap 一律 403，攻击者无法覆盖管理员账号。GET /admin/settings/init 未初始化渲染引导表单（settings_init.html，含 id=bootstrap-form），已初始化 302 跳 /admin/login。GET /api/admin/settings（T5）不暴露 admin_username/admin_password_hash 两凭据 key（它们不在 CONFIG_REGISTRY，T5 GET 仅遍历注册表）。企微三件套写入复用 T5 既有 _normalise_value 校验并 repository.upsert（is_secret 字段正确，oauth_secret 入库 is_secret=True）。bootstrap 两端点及 bootstrap-status 均为公开（无鉴权依赖），符合首次初始化设计意图，且靠 is_initialized 门禁防重放。\n\n【两项观察，不构成本票失败】\n(1) `git log origin/main..HEAD` 含 1 个提交 `8f018e9 RND-249`——这是前票 RND-249（已 PASS 验收）由用户本地 commit 的产物，并非 RND-250 改动；RND-250 自身 7 文件全部未提交（git status 可证）。no_commit_or_push 按“本票改动未提交”判 true。建议用户在合并前将 origin/main 同步（或确认 8f018e9 已就绪）。\n(2) auth.py 用内联 `__import__('app.config.guard', fromlist=[...])` 以保持 diff 仅 2 行，功能正确但偏非常规写法；若后续想更易读，可改为模块顶部 `from app.config.guard import get_bootstrap_config_value`（仍属本票所有权内微调，非必须）。\n\n配置中心 T6（RND-250）9 条 AC 全 PASS，可进入收口流程。"
}
